{
  "$schema": "http://json-schema.org/draft-07/schema#",
  "title": "BUZZCRAFT JSON Project Schema",
  "type": "object",
  "required": ["meta", "config", "structure", "contentSchema"],
  "additionalProperties": false,
  
  "properties": {
    "meta": {
      "type": "object",
      "required": ["projectId", "version", "title", "description", "created", "lastModified", "author", "buzzcraft_version"],
      "additionalProperties": false,
      "properties": {
        "projectId": {
          "type": "string",
          "pattern": "^[a-z0-9-]+$",
          "minLength": 3,
          "maxLength": 50
        },
        "version": {
          "type": "string",
          "pattern": "^\\d+\\.\\d+\\.\\d+$"
        },
        "title": {
          "type": "string",
          "minLength": 3,
          "maxLength": 100
        },
        "description": {
          "type": "string",
          "minLength": 10,
          "maxLength": 300
        },
        "created": {
          "type": "string"
        },
        "lastModified": {
          "type": "string"
        },
        "author": {
          "type": "string"
        },
        "buzzcraft_version": {
          "type": "string",
          "pattern": "^\\d+\\.\\d+\\.\\d+$"
        }
      }
    },
    
    "config": {
      "type": "object",
      "required": ["domain"],
      "properties": {
        "domain": {
          "type": "string"
        },
        "ssl": {
          "type": "boolean",
          "default": true
        }
      }
    },
    
    "structure": {
      "type": "object",
      "required": ["pages"],
      "properties": {
        "pages": {
          "type": "object",
          "minProperties": 1,
          "maxProperties": 20
        }
      }
    },
    
    "contentSchema": {
      "type": "object"
    }
  }
}
