{
  "meta": {
    "projectId": "dubois-simple",
    "version": "1.0.0",
    "title": "Dubois Plomberie",
    "description": "Plombier professionnel à Saint-Étienne",
    "created": "2025-07-11T00:31:07.674Z",
    "lastModified": "2025-07-11T00:31:07.674Z",
    "author": "BUZZCRAFT",
    "buzzcraft_version": "1.0.0"
  },
  "config": {
    "domain": "example.com",
    "colors": {
      "primary": "#3B82F6",
      "secondary": "#EF4444",
      "accent": "#10B981"
    }
  },
  "structure": {
    "pages": {
      "home": {
        "route": "/",
        "modules": []
      }
    }
  },
  "contentSchema": {}
}
